{"$schema":"https://json-schema.org/draft/2020-12/schema","$id":"https://agile-v.org/schemas/GOVERNANCE_CONVERSION.schema.json","title":"Governance conversion","type":"object","required":["schema_version","compatibility","migration","fixture_owner","conversion"],"properties":{"schema_version":{"const":"1.0"},"compatibility":{"type":"string","minLength":1},"migration":{"type":"string","minLength":1},"fixture_owner":{"type":"string","minLength":1},"conversion":{"type":"object","required":["id","source_findings","failure_class","recurrence_count","classification","proposed_change","evidence","decision"],"properties":{"id":{"pattern":"^GOVCONV-[A-Z0-9-]+$"},"source_findings":{"type":"array","minItems":1,"items":{"type":"string"}},"failure_class":{"type":"string","minLength":1},"recurrence_count":{"type":"integer","minimum":0},"classification":{"type":"object","required":["local","structural"],"properties":{"local":{"type":"boolean"},"structural":{"type":"boolean"}},"additionalProperties":true},"proposed_change":{"type":"object","required":["type","target_ref"],"properties":{"type":{"enum":["control","architecture","test_invariant","tool_policy","skill_contract"]},"target_ref":{"type":"string","minLength":1}},"additionalProperties":true},"evidence":{"type":"object","required":["recurrence_refs","root_cause_ref"],"properties":{"recurrence_refs":{"type":"array","items":{"type":"string"}},"root_cause_ref":{"type":"string","minLength":1},"held_out_validation_ref":{"type":"string"}},"additionalProperties":true},"decision":{"type":"object","required":["status"],"properties":{"status":{"enum":["proposed","approved","rejected","deployed","validated"]},"authority_ref":{"type":"string"},"proposer_ref":{"type":"string"}},"additionalProperties":true},"effective_from":{"type":"object","properties":{"lifecycle_baseline":{"type":"string"}},"additionalProperties":true}},"additionalProperties":true,"allOf":[{"if":{"properties":{"decision":{"properties":{"status":{"enum":["approved","deployed","validated"]}},"required":["status"]}},"required":["decision"]},"then":{"properties":{"decision":{"required":["status","authority_ref"]}}}}]}},"additionalProperties":false}
